{
  "$schema": "../schemas/profile.schema.json",
  "schema_version": 1,
  "profile_name": "Custom India",
  "country_code": "IN",
  "default_currency": "INR",
  "sites": [
    {
      "site_name": "Example",
      "base_url": "https://example.com/",
      "scraping_type": "category",
      "browser_config": {
        "headless": true,
        "js_rendering": false,
        "timeout_ms": 1000
      },
      "categories": {
        "gpu": {
          "path": "gpu",
          "pagination_pattern": "page/{page}",
          "max_pages": 1
        }
      },
      "selectors": {
        "product_container": ".product",
        "title": ".title",
        "price": ".price",
        "url": "a"
      }
    }
  ]
}
